[
  {
    "id": "champion_strength_001",
    "type": "champion_strength",
    "champion": "Darius",
    "role": "上单",
    "tier": null,
    "score": 8,
    "score_type": "subjective_strength",
    "confidence": "low",
    "patch": "unknown",
    "rank_scope": "unknown",
    "source_type": "forum_text",
    "source_refs": [],
    "raw_evidence": [
      "诺手太难打了，近战上单被他拉到基本就炸线，前期压力特别大。"
    ],
    "evidence": {},
    "tags": [
      "压制力",
      "线霸",
      "对线强势"
    ],
    "weaknesses": [],
    "reason": "用户主观描述诺手在对线近战上单时强度极高，能轻易造成炸线，属于玩家观点，confidence为low。"
  },
  {
    "id": "champ_strength_001",
    "type": "champion_strength",
    "champion": "Kennen",
    "role": "上单",
    "tier": "unknown",
    "score": 9,
    "score_type": "matchup_difficulty",
    "confidence": "low",
    "patch": "unknown",
    "rank_scope": "unknown",
    "source_type": "forum_text",
    "source_refs": [],
    "raw_evidence": [
      "If Kennen just plays disciplined and doesn't get greedy, you'll never find a kill window all lane until their jungler shows up and dives you."
    ],
    "evidence": {
      "win_rate": null,
      "sample_size": null,
      "pick_rate": null,
      "ban_rate": null,
      "opinion_count": null
    },
    "tags": [
      "counter",
      "上单",
      "压制力"
    ],
    "weaknesses": [],
    "reason": "玩家将Kennen列为'极难'对局，认为同等水平下Darius无法击杀，体现Kennen对线压制力强。",
    "review_status": "pending"
  },
  {
    "id": "champ_strength_002",
    "type": "champion_strength",
    "champion": "Vayne",
    "role": "上单",
    "tier": "unknown",
    "score": 8,
    "score_type": "matchup_difficulty",
    "confidence": "low",
    "patch": "unknown",
    "rank_scope": "unknown",
    "source_type": "forum_text",
    "source_refs": [],
    "raw_evidence": [
      "She's just great at bullying bruisers, but her roaming is so good that it feels like Darius's strength as a lane bully just disappears."
    ],
    "evidence": {
      "win_rate": null,
      "sample_size": null,
      "pick_rate": null,
      "ban_rate": null,
      "opinion_count": null
    },
    "tags": [
      "counter",
      "上单",
      "风筝"
    ],
    "weaknesses": [],
    "reason": "玩家认为Vayne擅长欺负重装战士，Darius的线霸优势消失，属极难对局。",
    "review_status": "pending"
  },
  {
    "id": "champ_strength_003",
    "type": "champion_strength",
    "champion": "Tryndamere",
    "role": "上单",
    "tier": "unknown",
    "score": 8,
    "score_type": "matchup_difficulty",
    "confidence": "low",
    "patch": "unknown",
    "rank_scope": "unknown",
    "source_type": "forum_text",
    "source_refs": [],
    "raw_evidence": [
      "ngl if you go w max lethal tempo nimbus cloak ghost and swifties on tryn the darius matchup is actually pretty easy"
    ],
    "evidence": {
      "win_rate": null,
      "sample_size": null,
      "pick_rate": null,
      "ban_rate": null,
      "opinion_count": null
    },
    "tags": [
      "counter",
      "上单",
      "对线"
    ],
    "weaknesses": [],
    "reason": "玩家评论指出特定出装的泰达米尔对线Darius很容易，体现其counter能力。",
    "review_status": "pending"
  },
  {
    "id": "aatrox_strength_top_001",
    "type": "champion_strength",
    "champion": "Aatrox",
    "role": "上单",
    "tier": null,
    "score": 5,
    "score_type": "stat_strength",
    "confidence": "medium",
    "patch": "16.13",
    "rank_scope": "unknown",
    "source_type": "stats_site",
    "source_refs": [
      "https://op.gg/lol/champions/aatrox/build"
    ],
    "raw_evidence": [
      "Win rate 48.80%",
      "Pick rate 7.98%",
      "Ban rate 6.83%",
      "Tier E"
    ],
    "evidence": {
      "win_rate": 48.8,
      "pick_rate": 7.98,
      "ban_rate": 6.83,
      "sample_size": null
    },
    "tags": [
      "top",
      "low_winrate",
      "patch_16.13"
    ],
    "weaknesses": [],
    "reason": "基于OP.GG统计，Aatrox上单胜率48.8%低于50%，强度中等偏弱。",
    "review_status": "pending"
  }
]